name_m,name_f,description,source
monter układów hydraulicznych i pneumatycznych,,"montuje, serwisuje i naprawia systemy, które używają płynów pod ciśnieniem (hydraulika) lub sprężonego powietrza (pneumatyka), aby wprawiać w ruch maszyny i urządzenia, na przykład w fabrykach czy koparkach",Urząd Pracy
monter urządzeń chłodniczych i gastronomicznych,,"instaluje, konserwuje i naprawia urządzenia chłodnicze, takie jak lodówki i zamrażarki, oraz sprzęt gastronomiczny, na przykład piece i zmywarki, zapewniając ich prawidłowe działanie w sklepach, restauracjach i innych miejscach",Urząd Pracy
monter urządzeń energetyki odnawialnej,,"montuje, podłącza i serwisuje urządzenia takie jak panele słoneczne, turbiny wiatrowe czy pompy ciepła, aby domy i firmy mogły czerpać energię ze źródeł odnawialnych",Urząd Pracy
monter urządzeń laserowych,,"składa i instaluje zaawansowane urządzenia laserowe, dbając o ich precyzyjne działanie i konfigurację do różnych zastosowań, od medycyny po przemysł",Urząd Pracy
monter urządzeń medycznych,,"zapewnia prawidłowe działanie zaawansowanych urządzeń medycznych, od aparatów rentgenowskich po roboty chirurgiczne, poprzez ich montaż, instalację, regularny serwis i naprawy, co jest kluczowe dla bezpieczeństwa i skuteczności leczenia pacjentów",Urząd Pracy
monter urządzeń sterowania ruchem kolejowym,,"sprawdza, instaluje i konserwuje urządzenia odpowiedzialne za sterowanie ruchem pociągów, dbając o to, by sygnalizacja i zwrotnice działały niezawodnie dla bezpieczeństwa na torach",Urząd Pracy
monter urządzeń sterowania ruchem pociągów metra,,"instaluje, naprawia i konserwuje skomplikowane systemy elektroniczne oraz mechaniczne, które odpowiadają za bezpieczne i punktualne sterowanie ruchem pociągów metra",Urząd Pracy
monter urządzeń zdalnego sterowania i kontroli dyspozytorskiej metra,,"montuje, konserwuje i naprawia specjalistyczne urządzenia, dzięki którym dyspozytorzy metra mogą zdalnie sterować ruchem pociągów i monitorować całą sieć, zapewniając bezpieczeństwo pasażerów",Urząd Pracy
monter wiązek elektrycznych,,"montuje skomplikowane zestawy kabli i złączy, czyli wiązki elektryczne, które są jak 'nerwy' zasilające urządzenia, pojazdy i maszyny",Urząd Pracy
monter wiertni,,"instaluje, konserwuje i naprawia duże, specjalistyczne urządzenia oraz całe konstrukcje wiertnicze, które służą do wydobywania surowców spod ziemi",Urząd Pracy
"monter wyrobów tekstylnych, z tektury i pokrewnych materiałów",,"montuje różnorodne produkty, od ubrań i akcesoriów po opakowania i elementy wystawowe, precyzyjnie łącząc ze sobą tkaniny, tekturę oraz inne podobne materiały",Urząd Pracy
monter wyrobów z drewna,,"montuje i precyzyjnie łączy ze sobą gotowe elementy drewniane, takie jak części mebli, okien czy drzwi, używając narzędzi i dbając o jakość końcowego wyrobu",Urząd Pracy
monter wyrobów z tworzyw sztucznych,,"montuje ze sobą różnorodne elementy z tworzyw sztucznych, by powstawały z nich kompletne produkty, takie jak zabawki, części samochodowe czy obudowy sprzętów, często wykorzystując do tego specjalistyczne narzędzia i techniki",Urząd Pracy
monter zabudowy i robót wykończeniowych w budownictwie,,"montuje elementy konstrukcji wewnętrznych, takie jak ścianki działowe czy sufity podwieszane; wykonuje również wszystkie prace wykończeniowe, od tynkowania i malowania po układanie podłóg i płytek, aby budynki były gotowe do użytku i estetyczne",Urząd Pracy
monter żaluzji,,"montuje różne rodzaje żaluzji, rolet czy zasłon zewnętrznych i wewnętrznych, dbając o ich prawidłowe dopasowanie i funkcjonowanie w domach lub biurach",Urząd Pracy
monter zestrajacz urządzeń elektronicznych,,"montuje i instaluje komponenty elektroniczne; następnie precyzyjnie kalibruje i testuje gotowe urządzenia, by zapewnić ich optymalne działanie",Urząd Pracy
monter znaków nawigacyjnych,,"instaluje, naprawia i konserwuje boje, latarnie morskie oraz inne znaki nawigacyjne, które pomagają statkom bezpiecznie poruszać się po wodzie i unikać zagrożeń",Urząd Pracy
monter-elektronik,,"składa, łączy i uruchamia różnorodne podzespoły elektroniczne, tworząc z nich gotowe urządzenia, które następnie testuje, by upewnić się, że działają poprawnie",Urząd Pracy
monter-elektronik – aparatura medyczna,,"montuje i instaluje zaawansowaną aparaturę medyczną; dba o jej prawidłowe funkcjonowanie oraz naprawia usterki, aby lekarze mogli skutecznie pomagać pacjentom",Urząd Pracy
monter-elektronik – aparatura pomiarowa,,"montuje, testuje i naprawia skomplikowane urządzenia elektroniczne, które służą do precyzyjnych pomiarów w różnych dziedzinach, zapewniając ich niezawodne i dokładne działanie",Urząd Pracy
monter-elektronik – elektroniczne instrumenty muzyczne,,"montuje, konserwuje i naprawia elektroniczne instrumenty muzyczne, takie jak syntezatory czy gitary cyfrowe, dbając o ich idealne brzmienie i niezawodność",Urząd Pracy
monter-elektronik – elektroniczny sprzęt sygnalizacyjny i systemy sygnalizacyjne,,"montuje, podłącza i serwisuje elektroniczny sprzęt sygnalizacyjny oraz całe systemy, które służą do przekazywania informacji, ostrzegania lub sterowania; zapewnia ich niezawodne działanie",Urząd Pracy
monter-elektronik – instalacja anten,,"montuje anteny telewizyjne, satelitarne i internetowe na dachach czy ścianach budynków; podłącza do nich okablowanie oraz konfiguruje sprzęt elektroniczny, aby zapewnić użytkownikom stabilny i czysty odbiór sygnału",Urząd Pracy
monter-elektronik – naprawa sprzętu audiowizualnego,,"diagnozuje i naprawia wszelkie usterki w sprzęcie audiowizualnym, od telewizorów po systemy nagłośnieniowe; wymienia uszkodzone części i przywraca urządzeniom pełną sprawność",Urząd Pracy
monter-elektronik – sprzęt komputerowy,,"montuje, instaluje, diagnozuje i naprawia sprzęt komputerowy oraz jego podzespoły, zapewniając ich sprawne działanie",Urząd Pracy
monter-elektronik – układy elektroniczne automatyki przemysłowej,,"montuje, instaluje i naprawia elektroniczne ""mózgi"", które sterują pracą maszyn w fabrykach, dbając o to, by cała automatyka przemysłowa działała płynnie i bezawaryjnie",Urząd Pracy
monter-elektronik – urządzenia radiokomunikacyjne,,"montuje, testuje i serwisuje urządzenia elektroniczne, które pozwalają na bezprzewodową łączność, takie jak radia, nadajniki czy systemy komunikacji mobilnej",Urząd Pracy
monter-elektronik – urządzenia radiowo-telewizyjne,,"instaluje, serwisuje i naprawia urządzenia radiowo-telewizyjne; dba o ich prawidłowe działanie i optymalny odbiór sygnału",Urząd Pracy
monter-instalator urządzeń technicznych w budownictwie wiejskim,,"instaluje i montuje różnorodne urządzenia techniczne, takie jak systemy grzewcze, wodno-kanalizacyjne czy wentylacyjne, w budynkach mieszkalnych i gospodarczych na wsi",Urząd Pracy
monter-mechanik rowerów / wózków,,"montować rowery i wózki; diagnozować, naprawiać oraz konserwować je, aby zawsze były sprawne i bezpieczne w użytkowaniu",Urząd Pracy
mostowniczy,,"projektuje, buduje i remontuje mosty, dbając o ich bezpieczeństwo i trwałość dla podróżujących",Urząd Pracy
motorzysta wachtowy,,"obsługuje i kontroluje silniki oraz inne urządzenia na statku w czasie swojej wachty, żeby wszystko działało bez zarzutu",Urząd Pracy
murarz,murarka,"wznosi trwałe konstrukcje, takie jak domy, mury czy kominy, precyzyjnie układając cegły, pustaki lub kamienie i łącząc je zaprawą, co wymaga umiejętności i dbałości o szczegóły",Urząd Pracy
murarz-tynkarz,,"wznosi konstrukcje budowlane z cegieł i bloczków, a także tynkuje ściany oraz sufity, nadając im gładkie i estetyczne wykończenie",Urząd Pracy
muzealnik,muzealniczka,"opiekuje się zbiorami muzealnymi, bada je i przygotowuje z nich wystawy oraz programy edukacyjne, aby opowiadać zwiedzającym fascynujące historie",Urząd Pracy
muzyk,muzyczka,"tworzy, aranżuje i wykonuje muzykę, używając głosu lub instrumentów; jego celem jest poruszanie serc słuchaczy i dzielenie się swoją artystyczną wizją",Urząd Pracy
muzykolog,muzykolożka,"analizuje muzykę jako zjawisko kulturowe, badając jej historię, teorię, formy i wpływ na społeczeństwo, aby zrozumieć jej ewolucję i znaczenie dla człowieka",Urząd Pracy
muzykoterapeuta,muzykoterapeutka,wykorzystuje muzykę do prowadzenia terapii wspomagającej procesy edukacji i leczenia,Nietypowe zawody
mygłowacz,mygłowaczka,"myje głowy klientów, zapewniając im dokładne oczyszczenie i odświeżenie; często łączy to z relaksującym masażem skóry głowy",Urząd Pracy
mytnik,mytniczka,"pobierał myto, czyli opłaty za przejazd lub przewóz towarów, od podróżnych i kupców; kontrolował ruch na drogach, mostach i przy wjazdach do miast",Warhammer FRP
naczelnik / kierownik wydziału,,"zarządza zespołem pracowników, planuje i nadzoruje ich działania, a także odpowiada za efektywne funkcjonowanie całego wydziału i realizację jego celów",Urząd Pracy
nanotechnolog,nanotechnolożka,"projektuje, bada i tworzy materiały oraz urządzenia na poziomie atomów i molekuł; wykorzystuje tę wiedzę do opracowywania innowacyjnych rozwiązań w medycynie, elektronice i energetyce",Urząd Pracy
napełniający zbiorniki przenośne,napełniająca zbiorników przenośnych,"napełnia różnorodne przenośne zbiorniki, od butli gazowych po kanistry z paliwem, dbając o precyzję, bezpieczeństwo i prawidłowe przygotowanie ich do dalszego użytku czy transportu",Urząd Pracy
nastawniczy,nastawniczka,"steruje zwrotnicami i sygnałami na stacji kolejowej, aby bezpiecznie prowadzić pociągi po wyznaczonych torach i unikać wypadków",Urząd Pracy
naturopata,naturopatka,"doradza, jak dbać o zdrowie i wspiera organizm w powrocie do równowagi, stosując naturalne metody, takie jak odpowiednia dieta, zioła i zmiany w stylu życia",Urząd Pracy
nauczyciel akademicki,,"uczy studentów na uczelniach wyższych, przekazując im wiedzę z konkretnej dziedziny, a także samodzielnie prowadzi badania, odkrywając nowe rzeczy i rozwijając naukę",Urząd Pracy
nauczyciel bibliotekarz,,"kształtuje umiejętności informacyjne i czytelnicze uczniów, zarządzając jednocześnie zasobami biblioteki szkolnej i wspierając proces dydaktyczny",Urząd Pracy
nauczyciel domowy,,"prowadzi spersonalizowane zajęcia edukacyjne dla jednego ucznia lub małej grupy, często w domu; dostosowuje metody i program nauczania do indywidualnych potrzeb i tempa rozwoju podopiecznego",Urząd Pracy
nauczyciel doradca metodyczny,,"doradza innym nauczycielom, jak uczyć ciekawiej i skuteczniej, pomagając im w wyborze najlepszych metod pracy oraz rozwiązywaniu problemów w klasie, aby uczniowie lepiej rozumieli i chętniej się uczyli",Urząd Pracy
nauczyciel edukacji wczesnoszkolnej,,"prowadzi najmłodszych uczniów przez pierwsze lata edukacji, ucząc ich czytać, pisać i liczyć; jednocześnie rozwija ich kreatywność, samodzielność i umiejętności społeczne",Urząd Pracy
nauczyciel innych form wychowania przedszkolnego,,"prowadzi zajęcia edukacyjne i opiekuńcze dla małych dzieci poza tradycyjnym przedszkolem, wspierając ich wszechstronny rozwój poprzez zabawę i kreatywne aktywności",Urząd Pracy
nauczyciel konsultant,,"pomaga nauczycielom, uczniom i rodzicom zrozumieć i pokonać trudności w nauce, oferując specjalistyczne porady i wsparcie w rozwoju edukacyjnym",Urząd Pracy
nauczyciel logopeda,,"pomaga dzieciom i młodzieży w szkole lub przedszkolu prawidłowo mówić i komunikować się, ucząc ich poprawnej wymowy i korygując wady mowy",Urząd Pracy
nauczyciel muzyki w placówkach pozaszkolnych,,"uczy młodych ludzi grać na instrumentach, śpiewać lub rozumieć muzykę, rozwijając ich pasje i talenty w miejscach takich jak szkoły muzyczne, domy kultury czy na prywatnych zajęciach, czyli poza regularnym systemem szkolnym",Urząd Pracy
nauczyciel nauczania na odległość,,"uczy uczniów zdalnie, wykorzystując internet i specjalne platformy do przekazywania wiedzy, organizowania zajęć i wspierania ich rozwoju, zastępując tradycyjną szkołę wirtualnym środowiskiem nauki",Urząd Pracy
"nauczyciel niedostosowanych społecznie (pedagog resocjalizacji, socjoterapeuta)",,"pomagać młodym ludziom i dorosłym, którzy mają trudności z zachowaniem, przestrzeganiem zasad społecznych lub radzeniem sobie z emocjami, ucząc ich, jak budować lepsze relacje i odnaleźć swoje miejsce w społeczeństwie",Urząd Pracy
nauczyciel niesłyszących i słabosłyszących (surdopedagog),,"kształci dzieci i młodzież niesłyszącą oraz słabosłyszącą, ucząc ich komunikacji (np. języka migowego czy czytania z ust) i przedmiotów szkolnych, aby mogli rozwijać się i uczestniczyć w życiu społecznym",Urząd Pracy
nauczyciel niewidomych i  słabowidzących (tyflopedagog),,"uczy niewidomych i słabowidzących dzieci oraz młodzież, jak poznawać świat i zdobywać wiedzę, dostosowując metody nauczania do ich specjalnych potrzeb, aby mogli rozwijać się i być samodzielni",Urząd Pracy
nauczyciel osób z niepełnosprawnością intelektualną (oligofrenopedagog),,"uczy osoby z niepełnosprawnością intelektualną, jak radzić sobie w codziennym życiu i rozwijać swoje umiejętności, aby mogły być bardziej samodzielne i szczęśliwe",Urząd Pracy
nauczyciel praktycznej nauki zawodu,,"przygotowuje młodzież do pracy w konkretnym zawodzie, ucząc ich praktycznych umiejętności i pokazując, jak stosować wiedzę teoretyczną w codziennych zadaniach",Urząd Pracy
nauczyciel przedmiotów teoretycznych zawodowych,,"uczy młodzież teoretycznych podstaw i zasad działania w konkretnym zawodzie, na przykład jak programować czy naprawiać maszyny, zanim zaczną praktyczne zajęcia",Urząd Pracy
nauczyciel przedmiotów zawodowych artystycznych,,"uczy młodzież praktycznych umiejętności artystycznych, takich jak projektowanie graficzne czy fotografia, przygotowując ich do pracy w kreatywnych zawodach",Urząd Pracy
nauczyciel przedmiotu w szkole podstawowej,,"uczy uczniów szkoły podstawowej wybranego przedmiotu, np. matematyki czy historii, pomagając im zrozumieć świat i rozwijać swoje talenty",Urząd Pracy
nauczyciel przedmiotu w szkole ponadpodstawowej,,"uczy młodzież w szkole ponadpodstawowej konkretnego przedmiotu, przekazując im specjalistyczną wiedzę i rozwijając kluczowe umiejętności potrzebne do zdania matury oraz dalszego rozwoju osobistego i zawodowego",Urząd Pracy
nauczyciel przedszkola,,"uczy i wspiera małe dzieci w wieku przedszkolnym, rozwijając ich umiejętności społeczne, poznawcze i manualne poprzez zabawę oraz kreatywne zajęcia, przygotowując je do dalszej edukacji",Urząd Pracy
nauczyciel przewlekle chorych oraz osób z niepełnosprawnością ruchową,,"uczy i wspiera rozwój dzieci oraz młodzieży przewlekle chorej i z niepełnosprawnością ruchową, dostosowując metody nauczania do ich indywidualnych potrzeb i możliwości",Urząd Pracy
nauczyciel psycholog,,"wspiera uczniów w rozwoju emocjonalnym i społecznym poprzez zajęcia grupowe, a także indywidualnie pomaga im zrozumieć i pokonać trudności, by czuli się dobrze i sprawnie uczyli",Urząd Pracy
nauczyciel specjalista terapii pedagogicznej,,"wspiera dzieci i młodzież, które mierzą się z trudnościami w nauce lub rozwoju, stosując specjalistyczne metody i terapie, aby mogły w pełni wykorzystać swój potencjał edukacyjny",Urząd Pracy
nauczyciel sztuki w placówkach pozaszkolnych,,"prowadzi zajęcia z rysunku, malarstwa czy rzeźby w domach kultury i pracowniach; inspiruje młodych ludzi do rozwijania kreatywności i odkrywania talentów artystycznych poza szkolnym programem",Urząd Pracy
nauczyciel technologii informatycznych w placówkach pozaszkolnych,,"prowadzi dla młodzieży ciekawe warsztaty i kursy z programowania, robotyki czy grafiki komputerowej, rozwijając ich cyfrowe pasje poza szkolnymi murami",Urząd Pracy
nauczyciel w placówkach pozaszkolnych,,"wspiera młodych ludzi w odkrywaniu i rozwijaniu ich pasji oraz talentów; prowadzi inspirujące zajęcia pozalekcyjne w domach kultury, klubach czy prywatnych pracowniach",Urząd Pracy
nawigator,nawigatorka,"planuje i prowadzi podróż statków, samolotów lub pojazdów lądowych, precyzyjnie wyznaczając trasę i czuwając nad jej przebiegiem, by bezpiecznie dotrzeć do celu",Warhammer FRP
nawigator lotniczy,,"kieruje samolotem, precyzyjnie wyznaczając i monitorując jego trasę lotu, aby bezpiecznie i na czas dotarł do celu, wykorzystując do tego nowoczesne systemy nawigacyjne",Urząd Pracy
neurologopeda,neurologopedka,"pomaga dzieciom i dorosłym, którzy mają trudności z mówieniem, rozumieniem, czytaniem, pisaniem lub połykaniem, wynikające z zaburzeń neurologicznych lub uszkodzeń mózgu",Urząd Pracy
normalizator,normalizatorka,"tworzy zasady i normy, aby różne rzeczy, od zabawek po programy komputerowe, działały ze sobą bez problemów i były bezpieczne dla użytkowników",Urząd Pracy
noszowy,noszowa,"nosi i przenosi osoby chore lub ranne na specjalnych noszach, dbając o ich bezpieczeństwo podczas transportu, na przykład w szpitalu czy podczas akcji ratunkowej",Urząd Pracy
notariusz,notariuszka,"pomaga ludziom w załatwianiu ważnych spraw prawnych, takich jak sprzedaż mieszkania czy spisanie testamentu, potwierdzając autentyczność dokumentów i dbając o ich zgodność z prawem",Urząd Pracy
numerolog,numerolożka,"bada ukryte znaczenie liczb, na przykład daty urodzenia czy liter w imieniu, aby odczytać cechy charakteru, talenty oraz potencjalne wyzwania i możliwości w życiu człowieka",Harry Potter
nurek,nurkini,"nurkuje w głębinach, aby badać morskie życie, naprawiać konstrukcje podwodne, szukać zaginionych przedmiotów lub dokumentować podwodny świat",Urząd Pracy
obchodowy bloku,obchodowa bloku,"sprawdza i kontroluje działanie maszyn oraz systemów w konkretnym bloku elektrowni lub ciepłowni, aby zapewnić jego ciągłą i bezpieczną pracę",Urząd Pracy
obserwator radarowy żeglugi śródlądowej,,"obserwuje na ekranie radaru ruch na rzekach i kanałach, by pomagać w bezpiecznym prowadzeniu statku i unikać zderzeń z innymi jednostkami lub przeszkodami",Urząd Pracy
obuwnik,obuwniczka,"projektuje, wykonuje i naprawia obuwie, dbając o każdy detal, aby było ono wygodne, trwałe i estetyczne",Urząd Pracy
obuwnik miarowy,,"wykonuje ręcznie obuwie na indywidualne zamówienie, idealnie dopasowując je do kształtu i rozmiaru stopy klienta na podstawie dokładnych pomiarów",Urząd Pracy
obuwnik ortopedyczny,,"tworzy i dopasowuje specjalne buty lub wkładki, aby korygować wady stóp, łagodzić ból i poprawiać komfort chodzenia u osób z różnymi schorzeniami",Urząd Pracy
obuwnik przemysłowy,,"wytwarza obuwie w fabryce, obsługując maszyny do szycia, klejenia i montażu poszczególnych elementów buta w ramach masowej produkcji",Urząd Pracy
oceanolog,oceanolożka,"bada stan oceanów, czystość wody, żyjące organizmy",Nietypowe zawody
odkrywca,odkrywczyni,"bada odległe i niezbadane zakątki świata, aby odkrywać nowe lądy, kultury, gatunki czy zjawiska, poszerzając naszą wiedzę o planecie",Warhammer FRP
ogrodnik,ogrodniczka,"tworzy i pielęgnuje ogrody, parki oraz inne tereny zielone, sadząc rośliny, przycinając krzewy i drzewa, by cieszyły oko i wspierały środowisko",Urząd Pracy
ogrodnik – uprawa grzybów jadalnych,,"hoduje jadalne grzyby, takie jak pieczarki czy boczniaki, zapewniając im odpowiednią temperaturę, wilgotność i podłoże dla zdrowego rozwoju i obfitych zbiorów",Urząd Pracy
ogrodnik – uprawa roślin ozdobnych,,"tworzy i utrzymuje piękne przestrzenie, sadząc, pielęgnując i hodując różnorodne rośliny ozdobne – kwiaty, krzewy i drzewa – aby upiększać ogrody, parki, balkony i wnętrza",Urząd Pracy
ogrodnik – uprawa warzyw polowych,,"uprawia, pielęgnuje i zbiera warzywa rosnące na polach, dbając o każdy etap ich rozwoju od nasiona po dojrzały plon",Urząd Pracy
ogrodnik – uprawy pod osłonami,,"hoduje różnorodne rośliny, od warzyw po kwiaty, w specjalnych szklarniach i tunelach; dba o ich idealne warunki, takie jak temperatura czy nawodnienie, by rosły zdrowo niezależnie od pory roku",Urząd Pracy
ogrodnik producent nasion,,"hoduje różnorodne rośliny, starannie je selekcjonując i pielęgnując, aby pozyskać z nich zdrowe i żywotne nasiona do sprzedaży i dalszego siewu",Urząd Pracy
ogrodnik szkółkarz,,"pielęgnuje i rozmnaża młode rośliny, takie jak drzewa, krzewy i kwiaty, w specjalnych szkółkach; dba o ich zdrowy wzrost, aby mogły trafić do ogrodów, parków lub na sprzedaż",Urząd Pracy
ogrodnik terenów zieleni,,"zajmuje się zakładaniem i utrzymaniem w dobrej kondycji parków, skwerów i ogrodów; dba o rośliny, trawniki i ogólną estetykę zielonych przestrzeni",Urząd Pracy
operator dronów,operatorka dronów,"steruje dronami, by wykonywały różne trudne zadania",Nietypowe zawody
operator dźwięku,,"steruje sprzętem audio, takim jak mikrofony, miksery i głośniki, aby nagrać, miksować i odtwarzać dźwięk w filmach, muzyce, radiu czy na koncertach; dba o to, by jego brzmienie było czyste, zbalansowane i odpowiednio głośne",Urząd Pracy
operator kamery,,"obsługuje kamerę, dbając o odpowiednie kadrowanie, ostrość i płynność ruchu, aby uchwycić dynamiczne sceny, emocje czy ważne momenty dla produkcji filmowych, telewizyjnych, relacji na żywo czy teledysków",Urząd Pracy
operator koparki,,"obsługuje potężną maszynę budowlaną, koparkę; za jej pomocą wykonuje prace ziemne, takie jak kopanie fundamentów, formowanie terenu czy załadunek materiałów",Urząd Pracy
operator kserokopiarek,,"obsługuje kserokopiarki, powielając dokumenty, zdjęcia i inne materiały, oraz dba o ich prawidłowe działanie i zaopatrzenie w papier czy tusz",Urząd Pracy
operator ładowarki,,"obsługuje ciężką maszynę budowlaną z dużą łyżką, zwaną ładowarką; jego zadaniem jest przemieszczanie, kopanie i załadunek materiałów sypkich, takich jak ziemia, piasek czy gruz",Urząd Pracy
operator mostu zwodzonego,,"obsługuje most zwodzony, podnosząc go, by umożliwić przepływ statków, i opuszczając, by zapewnić bezpieczny przejazd pojazdom oraz pieszym",Urząd Pracy
operator myjni,,"kieruje pracą myjni, obsługując maszyny czyszczące i dbając, by samochody klientów były zawsze idealnie czyste i gotowe do drogi",Urząd Pracy
operator spalarni odpadów komunalnych,,"obsługuje i monitoruje zaawansowane urządzenia w spalarni, które przetwarzają odpady komunalne w energię elektryczną lub cieplną; dba o to, by proces ten był bezpieczny, efektywny i przyjazny dla środowiska",Urząd Pracy
operator spycharki,,"kieruje spycharką, aby przesuwać ziemię, równać teren i przygotowywać place budowy pod drogi, budynki czy inne konstrukcje",Urząd Pracy
operator tankowania statków powietrznych,,"obsługuje specjalistyczny sprzęt do napełniania statków powietrznych paliwem, dbając o bezpieczeństwo i precyzję podczas przygotowywania maszyn do lotu",Urząd Pracy
operator żurawia,operatorka żurawia,"obsługuje żuraw, aby z precyzją i dbałością o bezpieczeństwo podnosić oraz przenosić ciężkie ładunki na placach budowy, w portach czy magazynach",Urząd Pracy
opiekun dzieci na przejściach dla pieszych,opiekunka dzieci na przejściach dla pieszych,"kieruje ruchem pieszych i zatrzymuje pojazdy, aby dzieci mogły bezpiecznie przejść przez ulicę w drodze do i ze szkoły",Urząd Pracy
opiekun dzikich zwierząt,,"opiekuje się rannymi, chorymi lub osieroconymi dzikimi zwierzętami, zapewniając im leczenie i rehabilitację, by mogły bezpiecznie wrócić na wolność",Urząd Pracy
opiekun klienta,,"rozwiązuje problemy klientów, odpowiada na ich pytania i udziela wsparcia, aby zapewnić ich satysfakcję z produktów lub usług firmy",Urząd Pracy
opiekun medyczny,,"opiekuje się osobami chorymi, starszymi lub niepełnosprawnymi, wspierając je w codziennych czynnościach, dbając o higienę i komfort; monitoruje ich stan zdrowia i asystuje pielęgniarkom w procedurach medycznych",Urząd Pracy
opiekun osoby starszej,,"opiekować się osobami starszymi, wspierając je w codziennych czynnościach, dbając o ich bezpieczeństwo i zapewniając im towarzystwo, to istota pracy opiekuna",Urząd Pracy
opiekun w domu pomocy społecznej,,"opiekować się na co dzień osobami starszymi lub niepełnosprawnymi mieszkającymi w domu pomocy społecznej; wspierać ich w podstawowych czynnościach, takich jak higiena, jedzenie czy poruszanie się, dbając o ich komfort i godność",Urząd Pracy
opiekun wycieczek kosmicznych,opiekunka wycieczek kosmicznych,"oprowadza podróżników po odległych galaktykach i stacjach kosmicznych, dzieląc się fascynującymi historiami wszechświata oraz czuwając nad ich komfortem i bezpieczeństwem podczas międzygwiezdnych przygód",Nietypowe zawody
opiekun zwierząt domowych,,"opiekuje się zwierzętami domowymi, takimi jak psy, koty czy gryzonie, w czasie nieobecności ich właścicieli, zapewniając im jedzenie, spacery, zabawę i ogólną troskę",Urząd Pracy
opiekun domowa,opiekunka domowa,"pomaga osobom starszym, chorym lub niepełnosprawnym w ich domach, asystując im w codziennych czynnościach takich jak higiena czy przygotowanie posiłków; zapewnia im również towarzystwo i wsparcie emocjonalne",Urząd Pracy
